BusinessName,Telephone,Email
"mi Rubin's Plumbing & Heating Co., Inc.",(313) 363-9163,joneskenya@me.com
mi Wayne State University Islamic Center of Detroit,(313) 442-6308,cassmosque@gmail.com
mi Aey Heating & Cooling,(313) 581-8144,peacockroomdetroit@gmail.com
mi Daniel's Mechanical Heating & Cooling Refrigeration,(734) 839-6643,danielsmechanical@hotmail.com
mi Ivorys A1-Heating & Cooling / Refrigeration,(313) 778-3924,nates813@gmail.com
mi Detroit Jack & Tool Service,(313) 867-2100,
mi C&S Plumbing & Heating,(313) 400-9185,
mi Six Mile Appliances & Heating and Cooling,(313) 506-2193,
mi Motor City Ventilation Inc,(313) 843-8706,mcvent@earthlink.net
"mi A-Lurry Services, LLC",(313) 312-5236,a-lurryservices@outlook.com
mi AAA Construction Co,(313) 883-0900,
mi Plumb Pros Plumbing Heating & Air,(734) 261-4933,
mi Cameron & King Pl-Ht-Air,(313) 862-7100,
mi Marek Mechanical LLC,(586) 758-0764,
mi R M C Service Co,(313) 342-0808,
"mi Air Conditioning, Boiler, & Furnace Service Repairs",(313) 350-2212,
mi K & M Heating & Cooling,(734) 283-5485,
mi J.m.and sons maintenance,(734) 299-1822,
mi Eastpointe Plumbing and Heating,(586) 776-1742,
mi Sheldo’s Heating And Cooling,(313) 263-7010,
mi J & E Royalty Heating and Cooling,(248) 584-1060,
mi J&J Heating and Air Conditioning,(586) 344-3793,
mi Robert Thomason Heating & Cooling,(313) 382-0420,
mi Keating Heating,(313) 331-3520,
mi American Ideal Heating Company,(313) 842-2800,
mi Detroit Geothermal,(313) 922-8828,
mi 3A & K Heating Co,(313) 255-5698,
mi Smittys Heating,(313) 205-8846,
mi Klear View Mechanical System Inc,(313) 863-5650,
mi ABC Plumbing & Heating,(313) 967-5184,
mi Enterprise Mechanical,(313) 739-6500,
mi Afscme Local 542,(313) 961-9381,
mi GDR Home Heating & Air Conditioning Co,(248) 595-7851,
mi Morgan Mechanical,(313) 363-1194,
mi Detroit Heating and Cooling Co,(248) 340-3609,
mi Novoa’s Services,(678) 887-4942,
mi Hancock Street Plumbing and Heating,(313) 230-2012,
mi Quality Mechanical Systems,(313) 828-3933,
mi Jawani home services,(313) 491-9999,
mi Dunrite On Time,(517) 404-2995,
mi Gorilla Plumbing,(888) 731-8964,
mi Blessed Hands,(313) 778-3656,
mi Dexter Ave Sewer and Drain,(313) 230-1354,
mi SOMS Indoor Air Quality,(248) 924-9710,
mi P M Plumbing & Mechanical,(248) 392-6304,
mi Abe's Sewer and Plumbing,(313) 283-7413,
mi Parker's Heating and Cooling,(313) 410-6189,
mi Dan Wood Plumbing & Heating Services,(313) 841-5190,
mi Harold G. Plumbing and Heating,(313) 736-4479,
mi Ken's Refrigeration & Air Conditioning,(586) 519-0597,
mi Fire & Ice Construction,(248) 306-9409,
mi Sensible Heating & Cooling,(517) 515-8046,
mi Giroux Heating & Cooling,(313) 640-0067,
mi Anything Mechanical,(313) 566-4061,
mi Livernois Emergency Plumbing,(313) 749-1008,
mi Goodman Heating and Cooling,(313) 218-4343,
mi Archdale Plumbing and Heating,(313) 736-4483,
mi Active Heating & Air Conditioning,(800) 335-9993,
mi Kadiri Group,(313) 478-1724,
"mi D & F Heating, Fireplace and Chimney",(313) 870-7255,
mi K&H Heating and Cooling,(313) 445-9182,
mi Attar Enterprises Heating & Cooling,(734) 324-0054,
mi Monroe Street Sewer Cleaners,(313) 230-2011,
mi Parklane Heating & Cooling,(313) 581-1525,
mi JC's Heating & Cooling,(586) 806-5333,
mi R O G Mechanical,(313) 877-7677,
mi All Services Heating Cooling,(844) 396-5351,
mi J Milburn Mechanical LLC,(313) 384-7460,
mi R.E Squared,(313) 953-7990,
mi Dion's Complete Plumbing Heating & Cooling,(734) 800-3820,
mi Ches Services,(313) 683-4010,
mi Extreme Metal Works,(313) 205-9357,
mi Seal Mechanical,(248) 257-8161,
mi R&A Mechanical Hvacr,(313) 461-6430,
mi SCW Services,(734) 693-4210,
mi Bulldog Mechanical,(586) 489-8650,
mi Local Boys Heating & Cooling,(734) 365-2565,
mi American Plumbing Heating & Cooling,(810) 329-6000,
mi Deans Heating and Cooling,(734) 968-7652,
mi AA Service Tech,(313) 329-1923,
mi Fraser Heating and Cooling,(586) 405-8683,
mi Ameripro Heating and Cooling,(734) 276-4067,
mi Mike O’s Handy Pros,(313) 465-4944,
mi Williams Cooling & Heating Dvsn of Wllms Rfrgrtn &,(313) 372-5500,
mi E&T HVAC,(989) 614-2377,
mi Quality Comfort Heating and Cooling,(586) 222-7001,
mi Silver Shepherd Home Services,(586) 360-8564,
mi Bob T's Jack Of All Trades,(734) 299-0649,
mi Blevins And Stamm Hvac,(586) 438-1739,
mi Seels,(313) 297-4005,
mi Hybrid Heating & Cooling,(313) 779-5310,
mi Asap Heating And Cooling,(313) 208-1567,
mi Williams Heat and Cool,(313) 402-6542,
mi Kirby Plumbing Heating and Cooling,(313) 230-2274,
mi Smitty's Heating,(313) 420-4328,
mi Community Heating and Cooling,(313) 469-8641,
mi A & H Electrical Heating & Cooling,(313) 397-9381,
mi Attles Plumbing Heating & Cooling,(248) 499-3434,
mi Johnson Mehcanical HVAC,(313) 452-2417,
mi Ruetz Heating,(313) 216-8971,
mi Ecorse Plumbing Heating and Cooling,(313) 749-0565,
mi Dearborn Plumbing Heating and Cooling,(313) 749-0557,
mi Airwave Heating & Cooling Inc,(313) 388-4087,
mi Dearborn Air Conditioning Duct and Vent Cleaning,(313) 246-0864,
mi Max Dryer Vent Solutions & HVAC,(313) 327-3489,
mi Wholesale Heating & Cooling Melvindale,(313) 633-9840,
mi Ultimate HVAC Pros,(800) 262-2019,
mi Lawndale Plumbing And Heating,(313) 732-9198,
mi Morningside Plumbing Heating And Cooling3,(313) 732-9177,
mi Gemini Heating & Cooling Inc,(313) 527-9117,
mi Structure 1 Heating & Cooling,(248) 660-9228,
"mi Shiny's Plumbing, Heating & Cooling",(313) 515-2562,
mi Air Conditioning by Malestic Heating & Cooling,(313) 835-1606,
mi Loyal Attic Insulation Detroit,(855) 553-2797,
mi Top Team Attic Insulation Detroit,(855) 622-7361,
mi Eco Choice Attic Insulation Detroit,(877) 247-4770,
mi A1 Attic Insulation Company Detroit,(855) 357-9434,
mi Legacy Top Attic Services Detroit,(855) 627-3031,
mi Cadieux Road Plumbing & Heating,(313) 732-9470,
mi Conant Street Plumbing & Heating,(313) 230-2311,
mi Bernard's Plumbing & Heating,(313) 881-4278,
mi Detroit Heating & Air Conditioning Company,(248) 397-0860,
mi Hamtramck Heating & Cooling Emergency Response,(313) 356-5766,
mi Malachi Ducts Care & HVAC,(734) 530-3216,
mi Kai Dryer Vent Services,(313) 307-4402,
mi Elite Attic Services Detroit,(855) 627-1492,
mi Cool Temp Refrigeration,(313) 290-2793,
mi Ab Heating & Cooling,(313) 849-4279,
"mi A Action Heating & Cooling, Inc",(313) 702-0397,
mi 3rd Street Plumbing and Heating,(313) 230-2059,
mi Willis Street Plumbing and Heating,(313) 230-2288,
mi Plunk Heating and Cooling,(313) 473-8747,
mi Detroit Heating & Air Conditioning Company,(586) 467-0435,
mi J&E Heating and Cooling,(313) 530-3062,
mi Centre Street Plumbing and Heating,(313) 230-2273,
mi Perfection HVAC Services,(202) 915-5168,
mi Lancashire HVAC Services,(707) 877-8522,
mi Only I.R.S,(202) 217-5194,
mi Hamtramck Heating Company,(800) 873-6021,
mi J C Plumbing & Heating,(313) 230-2042,
mi AW Plumbing and Heating,(313) 230-2294,
mi Cass Plumbing and Heating,(313) 230-2123,
mi Caniff Street Plumbing and Heating,(313) 731-9133,
mi Deaborn Plumbing and Heating,(313) 749-1384,
mi Division Street Plumbing and Heating,(313) 230-2027,
mi Ss Plumbing And Heating,(313) 749-1040,
"mi A Action Heating & Cooling, Inc.",(313) 292-1411,
mi Holbrook Plumbing and Heating,(313) 230-2286,
mi Hamilton Ave Plumbing and Heating,(313) 731-9127,
mi Great Lakes Heating & Cooling,(313) 831-8015,
mi Buchanan St Plumbing and Heating,(313) 230-2082,
mi Mack Ave Plumbing and Heating,(313) 732-9339,
mi Commor Plumbing and Heating,(313) 731-1502,
mi East Plumbing,(248) 678-7541,eastplumbing@gmail.com
mi Bronson Heating & Cooling,(734) 662-9993,bronsonheating@aol.com
mi University of Michigan,(734) 764-1817,
mi Plumb Pros Plumbing Heating & Air,(734) 261-4933,
mi Eastpointe Plumbing and Heating,(586) 776-1742,
mi Absolute Heating & Air Conditioning,(734) 461-1112,
mi J.m.and sons maintenance,(734) 299-1822,
mi Booth Plumbing & Heating,(734) 663-6643,
mi Gates Heating & Cooling,(248) 437-1558,
mi Carlton Heating,(734) 981-0265,
mi Affordable Comfort Heating and Cooling,(828) 702-9227,
mi Accurate Comfort Systems,(734) 483-0731,
mi Thrifty Heating & Cooling,(734) 973-9330,
mi CRB Heating and Cooling,(734) 341-2841,
mi ACME,(313) 343-1545,
mi Parker's Heating and Cooling,(313) 410-6189,
mi Rite-Temp Refrigeration,(734) 716-1810,
mi Dion Mechanical Solutions,(734) 205-7623,
mi EZB Air,(248) 437-4844,
mi Novoa’s Services,(678) 887-4942,
mi Onnit Heating and Cooling,(734) 722-5761,
mi Detroit Heating and Cooling Co,(248) 340-3609,
mi Advanced Home Services,(734) 604-3230,
mi SCW Services,(734) 693-4210,
mi Walker Family Heating & Cooling,(517) 888-3007,
mi Ches Services,(313) 683-4010,
mi Dion's Complete Plumbing Heating & Cooling,(734) 800-3820,
mi Ameripro Heating and Cooling,(734) 276-4067,
mi Motown Mechanical Heating and Cooling,(734) 833-8036,
mi Mike O’s Handy Pros,(313) 465-4944,
mi Blevins And Stamm Hvac,(586) 438-1739,
mi Home Service - HVAC,(800) 560-2713,
mi Fallert Heating & Cooling,(248) 437-9977,
mi Jesus Duct Care & HVAC,(734) 530-3292,
mi Repair Lennox HVAC Systems,(734) 366-1933,
mi Flashing Heating & Cooling Repair,(734) 447-5214,
mi Flying Heating & Cooling Repair,(810) 206-2836,
mi Certa HVAC Repair Company,(517) 701-3282,
mi Ann Arbor Heating & Cooling,(734) 929-0600,
mi Advanced Attic Solutions Ann Arbor,(855) 217-0249,
mi A1 Attic Insulation Company Ann Arbor,(855) 357-9434,
mi SOS Attic Cleaners Ann Arbor,(877) 480-8176,
mi SOS Attic Masters Ann Arbor,(877) 635-9154,
mi Attic Control Ann Arbor,(855) 348-2267,
mi Loyal Attic Insulation Ann Arbor,(855) 553-2797,
mi SOS Attic Insulation Services Ann Arbor,(877) 472-9861,
mi Elite Attic Services Ann Arbor,(855) 627-1492,
mi Legacy Top Attic Services Ann Arbor,(855) 627-3031,
mi I D C Heating & Cooling,(734) 668-4131,
mi Repair Carrier HVAC Systems HVAC,(734) 316-8493,
mi Free Estimates Cooling,(734) 205-9513,
mi Lamkin Heating,(734) 484-3624,
mi Paul Robrtson Heating Saline,(734) 429-7295,
mi Jamnick Plumbing & Heating Inc,(734) 434-4023,
mi Saline Plumbing And Heating,(734) 944-4700,
mi Will Folsom heating and cooling,(248) 310-7768,williamfolsom47@gmail.com
mi Freeman Heating Air Conditioning Services,(248) 845-1424,
"mi Restaurant Ventilation Specialists, Inc.",(248) 363-3044,
mi Birmingham Heating & Air,(248) 752-1725,
mi Environmental Recovery Refrigeration,(248) 496-4545,
mi Detroit Heating and Cooling Co,(248) 340-3609,
mi Hypersonic Ruud HVAC Systems,(248) 621-4282,
mi Heating & Air Conditioning Company,(734) 452-2152,
mi Free Estimates Cooling,(248) 277-4803,
mi Brisk Heating & Cooling Repair,(248) 221-1563,
mi Davis Heating & Cooling,(248) 967-1609,
mi Lightninglike Heating & Cooling Repair,(248) 301-1437,
mi Emergency Heating & Air Conditioning Company,(734) 452-1962,
mi Productive Heating & Cooling Repair,(947) 221-0712,
mi Redford HVAC Pros,(313) 426-4621,
mi Apt Heating & Cooling Repair,(947) 252-2031,
mi Skilled Heating & Cooling Repair,(248) 920-8926,
mi Robin Aire Heating & Cooling,(248) 541-3300,
mi Clear Advantage Mechanical,(616) 520-5884,heatinggr@gmail.com
mi Residence Inn by Marriott Grand Rapids Downtown,(616) 776-5905,
mi Cook's Plumbing Heating & Cooling,(616) 589-4095,
mi Innovative Comfort & Energy Solutions,(616) 291-0756,
mi Brinker Mechanical Services,(616) 878-0229,
mi Total Comfort Resource,(616) 406-3182,
mi Evans Tempcon,(616) 361-2681,
mi Ruiter Heating & Cooling,(231) 733-8449,
mi Mac's Heating & Cooling,(616) 895-9090,
"mi Merkle & Company, Inc (MW36)",(248) 766-2750,
mi Accurate Heating & Cooling,(616) 885-4584,
mi Star Furnace Repair,(616) 256-0590,
mi Grand Rapids Air Conditioning Service & Repair,(616) 228-4216,
mi GLCCB REYES Coca-Cola Bottling,(616) 458-4536,
mi GRR PIPE,(616) 247-0307,
mi Central States Property,(616) 456-8561,
mi Premier Grand Rapids AC Repair & Cleaning Services,(616) 333-5703,
mi Cuello Air Conditioning & Refrigeration Service & Repair,(621) 748-3710,
mi AC Hotel by Marriott Grand Rapids Downtown,(616) 776-3200,
mi Michigan Heating & Cooling,(616) 538-7260,
mi Stienstra Heating & Cooling,(616) 258-2377,
mi Jarosch Heating & Cooling,(616) 552-1885,
mi Interstate Heating & Cooling,(616) 677-3500,
mi HVAC Grand Rapids,(616) 777-5199,
mi Thomas Heating and Cooling,(616) 988-2191,
mi Elite Indoor Comfort,(616) 538-4818,
mi Complete Air Services Heating & Cooling,(616) 878-1884,
mi Kyle Fischer Appliance Tech & Handyman,(616) 886-8029,
mi K & K Mechanical,(269) 447-7381,
mi Lakeshore Plumbing & Heating,(231) 861-7333,
mi Loc Heating & Cooling,(616) 583-0299,
mi Ace Appliance,(616) 206-0639,
mi Ramos Heating & Cooling,(616) 452-0020,
mi Cnc Appliance Repair,(616) 389-0344,
mi B Ph Mechanical Services,(616) 957-4470,
mi Heating Contractor Grand Rapids,(866) 214-9326,
mi Comfort Masters Heating & Air Conditioning,(616) 988-1560,
mi Air Technology Heating and Cooling,(616) 238-5365,
mi A1 Aafordable Air Conditioning & Heating,(616) 890-0319,
mi Perfectly Square Construction,(616) 608-2752,
mi Kris Kobylarz Heating and Cooling,(989) 334-5877,
mi Jp Quality Services,(616) 888-5661,
mi K&P Mechanical,(616) 325-4569,
mi Servicefirst Hvac Parts,(616) 243-0570,
mi The Building Performance Team,(616) 791-9180,
mi Envi Energy Experts,(805) 765-2720,
mi Diamond Heating & Cooling,(616) 459-3630,
mi Consumers Heating Company,(616) 456-1157,
mi Falicki Heating Co.,(616) 453-6174,
mi Cammenga & Karsemeyer Heating,(616) 318-0193,
mi Custom Climate Solutions Inc,(616) 301-9882,
mi Van Engen Heating & Cooling Llc,(616) 698-0703,
mi L. W. R. Heating & Cooling Inc.,(616) 784-4821,
mi C & G Services,(616) 975-0140,
mi Stearns Heating & Cooling LLC,(616) 550-5484,
mi 1st Class Heating Cooling Mech LLC,(616) 363-0938,
mi Northview Mechanical & Building,(616) 361-1140,
mi Rowells Heating AC & Service,(616) 530-9848,
mi Refrigeration Engineering,(616) 735-2562,
mi Taurus heating HVAC Services,(650) 360-2957,
mi Acme Heating & Cooling,(616) 453-9492,
mi DeGraff Heating & Cooling,(616) 451-0911,
mi Air Comfort Heating & Cooling L.L.C.,(616) 235-7470,
mi Trost Heating & Cooling Inc,(734) 522-6437,
mi Wolverine Mechanical Services,(734) 425-5100,
mi Furnace Guy Heating & Cooling,(734) 261-9190,
mi Btu Heating & Cooling,(734) 462-2610,
mi Plumb Pros Plumbing Heating & Air,(734) 261-4933,
mi Carlton Heating,(734) 981-0265,
mi O Best Heating And Cooling,(313) 728-5336,
mi Sheldo’s Heating And Cooling,(313) 263-7010,
mi Acme Heating & Cooling Company,(734) 464-6100,
mi Hobbs Mechanical Heating,(734) 427-8659,
"mi SunnyWinters Heating & Cooling, Inc.",(248) 358-5900,
mi Rna Heating & Cooling,(734) 459-1954,
mi Advance Heating & Cooling,(734) 722-1302,
mi Superior Heating & Cooling,(313) 724-1200,
mi Public Heating Company,(248) 478-7410,
mi Luter's Heating & Cooling,(313) 535-0386,
mi Environmental Recovery Refrigeration,(248) 496-4545,
mi Energy Savers Inc,(313) 255-0060,
mi Mechanical air llc,(313) 538-2819,
mi Morgan Mechanical,(313) 363-1194,
mi Northern Comfort Heating & Cooling,(313) 608-0652,
mi Shamrock Mechanical LLC,(734) 658-9672,
mi Attar Enterprises Heating & Cooling,(734) 324-0054,
mi K&H Heating and Cooling,(313) 445-9182,
mi THE APPLIANCE GURUZ,(810) 336-3366,
mi Gorilla Plumbing,(888) 731-8964,
mi SOMS Indoor Air Quality,(248) 924-9710,
mi South Lyon Heating & Cooling,(248) 437-1882,
mi Hoover,(734) 259-2423,
mi Robalee Mechanical,(419) 975-1926,
mi Handy Dan Home Improvements,(313) 929-5551,
mi Family Heating & Cooling,(248) 354-5001,
mi Novoa’s Services,(678) 887-4942,
mi Dunrite On Time,(517) 404-2995,
mi Rjays Home Services,(313) 471-4732,
mi EJJ Hvac Wholesale Supply,(313) 999-3734,
mi Charter Air,(734) 578-9771,
mi Kadiri Group,(313) 478-1724,
mi Detroit Heating and Cooling Co,(248) 340-3609,
mi Farmington Plumbing Heating and Cooling,(248) 957-0509,
mi Jawani home services,(313) 491-9999,
mi Gworks,(248) 499-3539,
mi Dependable Heating Cooling,(313) 779-7881,
mi Air Systems,(734) 453-6030,
mi Alex Heating And Cooling,(248) 499-2792,
mi West 11th Plumbing Heating and Cooling,(248) 957-0511,
mi Fire & Ice Construction,(248) 306-9409,
mi J Milburn Mechanical LLC,(313) 384-7460,
"mi D & F Heating, Fireplace and Chimney",(313) 870-7255,
mi Joiner Flooring Solutions,(313) 720-8373,
mi Blessed Hands,(313) 778-3656,
mi Doctor's Heating Cooling & Refrigeration,(313) 208-1567,
mi Seal Mechanical,(248) 257-8161,
mi R&A Mechanical Hvacr,(313) 461-6430,
mi Ches Services,(313) 683-4010,
mi Dion's Complete Plumbing Heating & Cooling,(734) 800-3820,
mi Deans Heating and Cooling,(734) 968-7652,
mi Daniel's Heating & Cooling,(586) 772-0400,
mi Duquet Arthur G Heating & Cooling,(248) 348-3770,
mi Swac Wholesale Heating A-C LLC,(313) 534-2665,
mi Farmington Hills Heating & Cooling Pros,(248) 579-4182,
mi I D C Heating & Cooling,(313) 255-2808,
mi Flashing Heating & Cooling Repair,(734) 447-5214,
mi Detroit Adequate Heating & Cooling Repair,(313) 403-2792,
mi Lightninglike Lennox HVAC Systems,(248) 621-4278,
mi Repair Lennox HVAC Systems,(734) 366-1933,
mi Nrthlnd Heating & Air,(313) 533-1927,
mi Tech IV Heating & Cooling,(734) 422-1285,
mi Heating & Air Conditioning Company,(734) 456-9174,
mi Grandell R A Heating Company Inc,(313) 534-2070,
mi A Able Heating & Cooling,(313) 561-4850,
mi Kevin S Heating Cooling,(313) 533-2080,
mi Hotwired Electric Heating and Cooling,(734) 427-2197,
mi Robindale Plumbing and Heating,(313) 952-9078,
mi National Heating & Cooling,(734) 464-3888,
mi Air Certified Heating Cooling & Airconditioning,(313) 533-2230,
mi Heating & Air Conditioning Company,(248) 277-4796,
mi Air Conditioning Specialties,(248) 939-8504,
mi Heating & Cooling Contractors,(248) 939-8503,
mi Cheap Heating & Air Conditioning,(313) 766-0107,
mi Absolute Comfort Heating & Cooling,(734) 513-9467,
mi Redford HVAC Pros,(313) 426-4621,
mi A Aaco Heating & Cooling,(248) 655-0550,
mi A Ross Heating & Cooling,(313) 274-6010,
mi Absolute Heating Cooling and Plumbing,(313) 977-9616,
mi Boiling Point Heating & Air Company,(248) 471-2677,
mi Heating Contractors & Specialties,(248) 939-8507,
mi Frederick Plumbing & Heating,(248) 358-3998,
mi P & T Heating and Cooling,(313) 784-8465,
mi Heating & Air Conditioning Company,(248) 957-0622,
mi Justin Dryer Vent Professionals & HVAC,(734) 530-3275,
mi Westland Plumbing Heating,(734) 456-5313,
mi Plymouth Plumbing Heating and Cooling,(734) 456-5296,
mi Gm Mechanical Heating COO,(313) 682-0905,
mi Siglers Heating and Cooling,(313) 406-3824,
mi Davis Heating & Cooling,(248) 967-1609,
mi Hypersonic Ruud HVAC Systems,(248) 621-4282,
mi Air Conditioning Service & Repair,(248) 939-8502,
mi Air Conditioning by Malestic Heating & Cooling,(313) 835-1606,
mi Kokke Heating & Cooling Inc,(248) 557-7730,
mi Cheap Heating & Air Conditioning,(734) 452-2153,
mi Ace Heating & Cooling,(734) 261-9058,
mi Temperature Unlimited Inc,(734) 266-2500,
mi Attic Insulation Expert Livonia,(877) 293-2310,
mi 911 Attic Insulation Livonia,(877) 271-9599,
mi SOS Attic Insulation Services Livonia,(877) 472-9861,
mi Legacy Top Attic Services Livonia,(855) 627-3031,
mi AttiCare Cmpany Livonia,(855) 213-6316,
mi TipTop Attic Insulation LLC Livonia,(855) 359-3282,
mi Affordable Attic Insulation Livonia,(877) 257-1580,
mi Attic Masters Insulation Services Livonia,(877) 253-9112,
mi A1 Attic Insulation Company Livonia,(855) 357-9434,
mi First Classic Heating & Cooling,(248) 477-9136,
mi Loyal Attic Insulation Livonia,(855) 553-2797,
mi Krutsch Services,(313) 535-8397,
mi GMB Heating & Cooling,(734) 367-4246,
mi All Furnaces Repair Service,(586) 339-5941,preferredheating@gmail.com
mi Parent Heating & Cooling,(248) 616-9980,parentheating@hotmail.com
mi Cameron & King Pl-Ht-Air,(313) 862-7100,
mi Sheldo’s Heating And Cooling,(313) 263-7010,
mi R M C Service Co,(313) 342-0808,
mi Birmingham Heating & Air,(248) 752-1725,
mi Hobbs Mechanical Heating,(734) 427-8659,
mi A G Heating & Cooling Inc,(248) 204-9227,
mi Novoa’s Services,(678) 887-4942,
mi B&B Climate Control,(586) 222-1947,
mi Detroit Heating and Cooling Co,(248) 340-3609,
mi Seal Mechanical,(248) 257-8161,
mi Sensible Heating & Cooling,(517) 515-8046,
mi Dunrite On Time,(517) 404-2995,
"mi D & F Heating, Fireplace and Chimney",(313) 870-7255,
mi Fraser Heating and Cooling,(586) 405-8683,
mi Handy Dan Home Improvements,(313) 929-5551,
mi Blessed Hands,(313) 778-3656,
mi Jayâs Heat and Cooling,(586) 413-8028,
mi Bob Carpenter Heating Co,(248) 644-0123,
mi Jay Heating & Cooling,(313) 522-6054,
mi Shepherd Park Emergency Sewer and Drain,(248) 397-0330,
mi 5Star Infinity Heating And Cooling,(313) 999-6229,
mi Parker's Heating and Cooling,(313) 410-6189,
mi McCullough Icy Hot Heating &Cooling,(313) 244-9052,
mi Cheap Heating & Air Conditioning,(248) 728-0048,
mi Davis Heating and Cooling,(248) 281-6963,
mi Air Certified Heating Cooling & Airconditioning,(313) 533-2230,
mi Clawson Heating Maintenance,(248) 237-4744,
mi Detroit Skilled Heating & Cooling Repair,(313) 261-7261,
mi Snowden Plumbing and Heating,(313) 915-9146,
mi Dashing Heating & Cooling Repair,(248) 509-0059,
mi Redford HVAC Pros,(313) 426-4621,
mi Matt's Heating and Cooling,(586) 822-3799,mattsheating@att.net
mi Detroit Automatic Sprinkler Company,(586) 574-0100,terrisylvester@aol.com
mi Parent Heating & Cooling,(248) 616-9980,parentheating@hotmail.com
mi Aladdin Heating & Cooling,(586) 775-4646,
mi Superior Air Heating and Cooling,(586) 943-1093,
mi Reliable Energy Systems,(586) 772-5310,
mi Ron's Custom Heating & Cooling,(586) 263-1014,
mi Marek Mechanical LLC,(586) 758-0764,
mi North Star Refrigeration Heating & Cooling,(586) 939-0070,
mi Sheldo’s Heating And Cooling,(313) 263-7010,
mi J&J Heating and Air Conditioning,(586) 344-3793,
mi J & E Royalty Heating and Cooling,(248) 584-1060,
mi B & L Heating,(248) 288-3150,
mi Eastpointe Plumbing & Heating,(586) 776-1742,
mi Heatmasters Heating & Cooling,(586) 567-1976,
mi Heating Authority,(586) 268-1730,
mi Creative Heating And Cooling Inc.,(586) 943-1214,
mi Air Care HVAC,(248) 548-7776,
mi Ray's Refrigeration & Air Conditioning,(586) 755-1462,
mi Sise Heating & Air Conditioning,(586) 772-6810,
mi Roseville Heating & Cooling,(586) 294-7420,
mi City Express Mechanical Heating & Cooling,(586) 759-2050,
mi March Mechanical,(810) 560-0492,
mi Daniel's Heating Cooling Plumbing,(586) 772-0400,
mi HVAC Investments,(727) 228-9474,
mi A G Heating & Cooling Inc,(248) 204-9227,
mi Maven Heating Duct & Air Conditioning,(808) 946-4511,
mi Temp - 1 Heating & Cooling,(248) 686-4757,
mi Roman Empire Heating and Cooling,(586) 202-0672,
mi Morgan Mechanical,(313) 363-1194,
mi Detroit Heating and Cooling Co,(248) 340-3609,
mi Fraser Heating and Cooling,(586) 405-8683,
mi Ken's Refrigeration & Air Conditioning,(586) 519-0597,
mi Plt Heating & Cooling,(313) 423-0018,
mi Mobil Air,(248) 307-1938,
mi Kmetz Heating & Cooling,(586) 777-1929,
mi Abe's Sewer and Plumbing,(313) 283-7413,
mi Goodman Heating and Cooling,(313) 218-4343,
mi Aero Heating & Cooling,(586) 493-6000,
mi Always Pray Heating & Cooling,(248) 556-8661,
mi Quality Mechanical Systems,(313) 828-3933,
mi Williams Cooling & Heating Dvsn of Wllms Rfrgrtn &,(313) 372-5500,
mi P M Plumbing & Mechanical,(248) 392-6304,
mi National Induction Heating,(248) 547-5700,
mi RoboVent,(586) 204-6833,
mi Daniel's Heating & Air Conditioning,(313) 527-5935,
mi EB Services,(586) 751-7300,
mi Hovey HVAC,(586) 531-1250,
mi Vance Avenue Emergency Sewer and Drain,(248) 397-0319,
mi J Milburn Mechanical LLC,(313) 384-7460,
mi Novoa’s Services,(678) 887-4942,
"mi D & F Heating, Fireplace and Chimney",(313) 870-7255,
mi Blessed Hands,(313) 778-3656,
mi Heating Plus Cooling,(313) 893-3400,
mi Seal Mechanical,(248) 257-8161,
mi R&A Mechanical Hvacr,(313) 461-6430,
mi C & C Heating and Air Conditioning,(586) 371-2020,
mi Warren Hvac Service,(586) 244-7066,
mi American pride heating and cooling,(248) 561-3898,
mi C & C Heating and Air Conditioning,(586) 218-3918,
mi Dion's Complete Plumbing Heating & Cooling,(734) 800-3820,
mi Quality Comfort Heating and Cooling,(586) 222-7001,
mi Silver Shepherd Home Services,(586) 360-8564,
mi Teds Plumbing Heating,(313) 670-5930,
mi Mike O’s Handy Pros,(313) 465-4944,
mi Titan Heating and Cooling,(734) 239-3820,
mi Williams Heat and Cool,(313) 402-6542,
mi E&T HVAC,(989) 614-2377,
mi B&B Climate Control,(586) 222-1947,
mi Jam's Maintenance,(586) 459-8433,
mi Hazel Park Plumbing and Heating,(248) 397-0269,
mi Detroit Ductless Air Conditioning & Heat Pumps,(313) 771-8807,
mi Hamtramck Heating & Cooling Emergency Response,(313) 356-5766,
mi Madison Heights We Service Heating & Cooling Makes & Models,(248) 301-2591,
mi Heating & Air Conditioning Company,(586) 298-3738,
mi Detroit Able Heating & Cooling Repair,(313) 466-7157,
mi Holiday Heating,(313) 647-4468,
mi Vision Air Heating and Cooling,(586) 343-8118,
mi Clinton Township Heating & Cooling,(586) 649-3170,
mi Jet's Plumbing Heating & Cooling,(313) 769-4176,
mi Detroit Casement Air Conditioning Repair,(313) 497-4411,
mi Exclusive Heating,(313) 397-2811,
mi Tech IV Heating & Cooling,(586) 466-4000,
mi Max Dryer Vent Solutions & HVAC,(313) 327-3489,
mi Quick Heating & Cooling Repair,(586) 265-5687,
mi Detroit Skilled Heating & Cooling Repair,(313) 261-7261,
mi Nimble Heating & Cooling Repair,(586) 666-4784,
mi Davis Heating & Cooling,(248) 967-1609,
mi Lakeview Heating Cooling Plumbing & Electrical,(586) 436-3438,
mi Camelot Heating & Air Conditioning Heating & Air Conditioning/HVAC,(877) 361-3008,
mi Fleet Carrier HVAC Systems,(248) 509-0544,
mi Acme Air Conditioning & Heating,(726) 200-1700,
mi Winged Heating & Cooling Repair,(586) 666-4949,
mi Air Flow Heating Supply,(586) 755-1996,
mi Triple A Heating Company,(586) 755-1920,
mi Advanced Attic Solutions Warren,(855) 217-0249,
mi A1 Attic Insulation Company Warren,(855) 357-9434,
mi Repair Trane HVAC Systems,(586) 204-8894,
"mi City Express Heating & Cooling, Inc.",(248) 547-0200,
mi Arctic Flame Heating & Cooling,(586) 932-3374,
mi Roseville Plumbing Heating and Cooling,(586) 298-3204,
mi Polar Heating & Cooling,(586) 778-5430,
